{
  "id": "01-hero",
  "order": 0,
  "source": { "kind": "html", "ref": "body > main > section:nth-of-type(1)", "url": "file:///acme/landing.html" },
  "kind": "hero",
  "slots": [
    { "name": "heading", "type": "heading", "value": "Acme ships faster", "provenance": "exact" },
    { "name": "text", "type": "text", "value": "Plan, build and launch in one place.", "provenance": "exact" },
    { "name": "image", "type": "image", "value": { "src": "https://acme.test/hero.png", "alt": "Acme dashboard" }, "provenance": "exact" },
    { "name": "link", "type": "link", "value": { "href": "https://acme.test/signup", "text": "Start free" }, "provenance": "exact" }
  ],
  "layout": { "columns": 1, "align": "left", "media": "right", "repeat": 0 },
  "tokens": [
    { "role": "heading", "prop": "color", "value": "rgb(17, 24, 39)", "provenance": "exact" },
    { "role": "button", "prop": "backgroundColor", "value": "rgb(10, 132, 255)", "provenance": "exact" }
  ],
  "refs": {}
}
